{
  "schema_version": "0.1",
  "result_id": "asr-result-0002",
  "source_audio": {
    "robot_id": "research-unit-01",
    "sensor_id": "audio-mock-01",
    "sequence": 4
  },
  "recognizer": "fake",
  "status": "no_speech",
  "text": "",
  "language": null,
  "confidence": null,
  "processed_at": "2026-07-17T08:04:01Z",
  "error": null
}
